,url,name,price,rating,reviewerCount,description,asin,manufacturer
63,https://www.amazon.in/Gear-Vintage2-Leather-Backpack-LBPVG2LTH1901/dp/B07G4F3758/ref=sr_1_69?crid=2M096C61O4MLT&keywords=bags&qid=1675355298&sprefix=ba%2Caps%2C283&sr=8-69,Gear Vintage2 Anti Theft Faux Leather 18 cms Tan Laptop Backpack,989,4.4,"1,404","Outer material: synthetic, color: Tan
Waterproof, Capacity: 27 liters; Weight: 600 grams; Dimensions: 48 cms x 33 cms x 18 cms (LxWxH)
Number of compartments: 2; Laptop compatibility: yes, laptop size: 16strap type: adjustable
Warranty type: Manufacturer; one year warranty against all manufacturing defects, workmanship, assistance during time of claim of warranty
Closure Type: Zipper; Special Features: Back Padding; Age Range Description: Adult; Pocket Description: Utility Pocket
Concealed quick access Pockets on back panel ,Adjustable Anti sweat padded Shoulder straps , Padded Laptop sleeve,3 External Pockets, Padded Back Panel Cushioned with Anti Sweat Fabric,Embedded Organizer , USB and Headphone cable slot .
",B07G4F3758,"Gear, Gear Merchandise PVT LTD E/12 West Chowbaga Gulshan colony KoLkata-700100 Contact 9830403366"
64,https://www.amazon.in/Genie-Glitter-Backpack-Women-compartments/dp/B097JHQH13/ref=sr_1_70?crid=2M096C61O4MLT&keywords=bags&qid=1675355298&sprefix=ba%2Caps%2C283&sr=8-70,"Genie Glitter Backpack for Women - 3 compartments, Laptop Bags for Girls, Stylish and Trendy College Backpacks for Girls, Water Resistant and Lightweight Bags for Office and Travelling Purpose.","1,099",4.3,300,"Made with High Quality fabric. Outer material: Nylon Twill - Soft, Durable and Water Resistant. Capacity: 36 liters, Dimensions: 48 x 33 x 23 cm Warranty: 12 months
3 Spacious compartment: Store your Books, Stationary, Accessories, Lunch boxes, etc. It will store plenty of items. Laptop Sleeve: Ensure that your laptop is stored separately and Securely! Organizer: Keep every single item separately in an arranged manner, with the help of our organizer. 2 side pocket: For holding water bottle, clipping pens or pencil or storing other items. 1 Front Pocket: Easily accessible. To keep all your essentials such as wallet, ticket, cosmetics.
Easy grab padded handle: For added comfort and convinience to hold the bag. Padded and Ergonomic Shoulder Straps: There is padded back mesh and ergonomic straps that gives extra spine and shoulder support and helps in minimizing the load after carrying the bag through a busy day at campus.This women's backpack can be carried to work, college, school, for a day out or even while you are travelling!
Light Weight yet Durable to resist the weight of textbooks, stationary, lunch boxes. Can store all your college or office stationary, without any hassle.
Stylish & Cute: This bag is designed for those Millennials and GenZ, who aren't afraid to compromise on Utility or Fashion! It is a perfect, small bag to carry all the daily essentials while using it as a trendy accessory, or a travel bag or as a college backpack.
",B097JHQH13,"Safari, 302-303, A Wing, The Qube CTS No.1498, A/2, Sir Mathuradas Vasanji Rd, Marol, Andheri East, Mumbai, Maharashtra 400059"
65,https://www.amazon.in/Gear-Polyester-Travel-Duffle-DUFCRSTNG0406/dp/B075MMWRW6/ref=sr_1_72?crid=2M096C61O4MLT&keywords=bags&qid=1675355298&sprefix=ba%2Caps%2C283&sr=8-72,Gear Polyester 74 Cms Duffle Bag(Dufcrstng0406_Grey),539,4.2,"15,916","WR PU Coated Dobby Polyester. WR PU Coated 900D Oxford Polyester. Color: Grey
Water Resistance: Water resistant, Wheels included: No
Capacity: 22 liters; Dimensions: 38 cms x 24 cms x 24 cms (LxWxH)
Number of compartments: 1
Laptop Compatibility: No, Strap Type: Adjustable.
Warranty type: Manufacturer; 1 year manufacturer warranty is non-transferable. Valid for 1 year from the original date of purchase.
",B075MMWRW6,"Gear, Gear Merchandise PVT LTD E/12 West Chowbaga Gulshan colony KoLkata-700100 Contact 9830403366"
66,https://www.amazon.in/Wildcraft-Turnaround-Polyester-Laptop-8903340000000/dp/B012D4QWES/ref=sr_1_73?crid=2M096C61O4MLT&keywords=bags&qid=1675355298&sprefix=ba%2Caps%2C283&sr=8-73,Wildcraft Turnaround Polyester 14 inch 27 Ltrs Blue Laptop Bag (8903340000000),"1,695",4.3,"3,184","Outer Material: Polyester, Color: Blue
Water Resistance: Water resistant; Dimensions: 36 cms x 13 cms x 50 cms (LxWxH)
Number of compartments: 3
Laptop Compatible: Fits up to 15.4 laptop
Light Weight
Note : Laptop compartment has no strap
",B012D4QWES,Wildcraft
67,https://www.amazon.in/American-Tourister-Polypropylene-LG4-002_Crimson/dp/B0BB2LKNXG/ref=sr_1_74?crid=2M096C61O4MLT&keywords=bags&qid=1675355298&sprefix=ba%2Caps%2C283&sr=8-74,American Tourister KAMILIANT Polypropylene Hard 68 cms Luggage (LG4 (0) 00 002_Crimson)(46×68×28) cm Travel Bag,"2,899",4.2,121,"Boxy shape for maximum volume and retractable top and side handles for comfort
Dual texture with matte finish and 3 digit fixed combination lock for extra security
Cross ribbons in bottom compartment and U-shaped pocket for maximum packing space
Sturdy and lightweight, with 360-degree smooth rolling wheels
50-50 packing makes organization and segregation easier
",B0BB2LKNXG,"Samsonite South Asia Pvt Ltd, Marketed by : Samsonite South Asia Pvt. Ltd. GAT no. 159 to 163, Gonde, Taluka - Igatpuri, Nashik : 422403"
68,https://www.amazon.in/ZIPLINE-Polyester-Backpack-Children-Daypack/dp/B07XVMR33Q/ref=sr_1_77?crid=2M096C61O4MLT&keywords=bags&qid=1675355298&sprefix=ba%2Caps%2C283&sr=8-77,ZIPLINE Unisex Casual Polyester 36 L Backpack School Bag Women Men Boys Girls Children Daypack College Bag Book School Sports Bag Weekend Bag,843,4.0,"4,940","MULTI-FUNCTION COMPARTMENT: ZIPLINE backpack features multiple storage compartments and features for additional supplies and accessories as your, iPhone, iPad, pen, keys, wallet, books, clothes, bottle, passport and more,
DURABLE MATERIAL: Superior quality durable ECO Friendly waterproof and anti-scratch polyester and featuring a reinforced bottom to withstand heavy use, perfect for business, travel, school and other outdoor activities
COMFORTABLE DESIGN: Our backpack's ""S"" Curve adjustable, heavily padded shoulder straps and back panel make the backpack comfortable to wear even when loaded with all your gear; Compact:Backpack has a roomy Three compartment, front zipper pockets to hold small accessories, one internal security zippered pocket for valuable items and side pockets for water bottle or umbrella.
Size:18*13*9 inch(L*W*H), Capacity: 36.5L which is bigger than others of the same style. Good size for school, camping, travel, shopping, hiking, climbing, vintage backpack for men and women.; Age Range Description: Kid; Special Features: Water Bottle Umbrella Pouch; Pocket Description: Utility Pocket
Compartment Description: Not Laptop Compatible; Warranty Description: 1 Year From The Date Of Purchase
",B07XVMR33Q,"Atulitu Agency, ,251/3364, Tagore Nagar - 1, Vikhroli East, Mumbai - 400083 (9820078070)"
69,https://www.amazon.in/Casual-Backpack-Charging-Laptop-Compartment/dp/B07J46KLFP/ref=sr_1_78?crid=2M096C61O4MLT&keywords=bags&qid=1675355298&sprefix=ba%2Caps%2C283&sr=8-78,"Fur Jaden 15.6 Inch Laptop Backpack 25 LTR Bag for School, College and Office with USB Charging Port",489,3.8,"9,820","Grey Colour Backpack for Men for Stylish Office use as well as for Trendy College and School students. Huge compartment size that can fit upto a 15.6 inch Laptop with ease. Multiple pockets for other accessories and water bottle
Capacity: 25 liters; Weight: 500 grams; Dimensions: 30 cms x 20 cms x 42 cms (LxWxH)
The backpack features a sleek and ergonomic design with a balanced weight distribution through its straps. This makes this product a suitable alternative to bulky and unsightly backpacks. The compact design of this backpack helps you to rest it comfortably on your shoulders while accommodating all your essentials with ease.
USB Charging Point to Charge On the Go - With our attached charging dock, now charing on the go is easier than before. Important Note: We do not provide Free Portable Charger with the Bag
Warranty- 10 days No Question asked replacement guarantee from the date of delivery. 6 Month Manufacturer and Seller Warranty
",B07J46KLFP,"Fur Jaden, Fur Jaden 3-C, Jai Hind Bld, Dr AM Road, Bhuleshwar, Mumbai 400002, 8080888028"
70,https://www.amazon.in/Lavie-Malgana-Womens-Tote-Black/dp/B07PKHC72N/ref=sr_1_79?crid=2M096C61O4MLT&keywords=bags&qid=1675355298&sprefix=ba%2Caps%2C283&sr=8-79,Lavie Women's Malnov Tote Bag | Ladies Purse Handbag,"1,013<span class=""a-price-decimal"">.</span>",4.1,"4,826","Lavie Malnov tote is a stylish offering for ladies. It is durable, light weight and super spacious. Made from vegan leather, this large hand bag comes in Herringbone, Woven and Croco texture pattern at the front.
Herringbone Texture- 45 cm in length x 14 cm in width x 30 cm in height
Malnov hand bag has a top zip closure for safety and comfort. The interior has 2 slip pockets along with 1 zip pocket providing plenty of storage space for keeping phone, portable charger, keys, hairbrush, wallet, sunglasses, sanitizer and a pair of clothes.
This latest tote is perfect for women to carry for a weekend getaway or even a day at the mall for shopping. It can be paired with formal pants & blazer as well as with a basic crop top and jeans. This spacious and sturdy bag makes for a perfect gift for all your occasions.
The bag has a well stitched inner lining and high quality zippers for easy accessibility and storage.
",B07PKHC72N,"Lavie, Bagzone Lifestyle Pvt Ltd | | LAVIE 402, Ackruti Star, MIDC Central Road, Andheri East, Mumbai – 400093"
71,https://www.amazon.in/ALIZA-Womens-Tote-Bag-Black/dp/B08JJ8RQNR/ref=sr_1_80?crid=2M096C61O4MLT&keywords=bags&qid=1675355298&sprefix=ba%2Caps%2C283&sr=8-80,ALIZA Women's Tote Bag,426,4.0,"7,624","One compartment ( Number of Pocket.3)
Size: Large / Looked: Beautiful Messenger/Tote bag
Outer Material Type: Polyurethane
",B08JJ8RQNR,
72,https://www.amazon.in/HOT-DELIVERY-BAG-Insulated-waterproof/dp/B08VJ4VWGZ/ref=sr_1_81?crid=2M096C61O4MLT&keywords=bags&qid=1675355298&sprefix=ba%2Caps%2C283&sr=8-81,"HOT DELIVERY BAGS Insulated and Waterproof Door Hanging Bag for Milk Sachets and Bottles Storage, Durable and Light Weight (Sea Green)",649,4.5,250,"Durable and Lightweight - The Door Hanging Bag is strong and lightweight, holds your bottles snugly in place and protects bottles from breaking. Stain-resistant, reusable and time again, perfect bottle carrier.
Waterproof PVC Fabric for Outer Material & Thermally PET Insulated Linings i.e. Aluminum Linings for Inner Fabric
6 Way Insulation to keep the Milk Cold and Fresh in Any climate, 1 Liter Bottle, 500 ml Bottles ,250 ml Milk bottles can easily be accommodated inside the Insulated Milk Door Hanging Bags
Door Hanging bags are Made From Soft Fabric that protects Milk Glass Bottles from Dust & Scratches and keep the Bottles Temperature stable what it is loaded at
Ice Packs are used to soak the moisture from the bottle and maintain a stable temperature inside the bag
",B08VJ4VWGZ,"Shree Suppliers, Shree Suppliers, 9833712003"
73,https://www.amazon.in/Priority-Spider-ltrs-School-Backpack/dp/B0849MZF6Q/ref=sr_1_82?crid=2M096C61O4MLT&keywords=bags&qid=1675355298&sprefix=ba%2Caps%2C283&sr=8-82,"Priority Disney Marvel Spiderman 25 litres Grey School Bag | Casual Backpack for Boys & Girls, Kid's Backpack",349,3.6,"6,184","Outer Material: Polyester, Inner Material: Fabric, Color: Grey
Laptop Compartment : No, No. of Compartment : 2, No.of Front Pocket : 2, No. of Bottle Pocket : 2
Warranty : 1 Year,Product Dimension : 34cm X 24cmX 49cm
Utility : School Backpack, College Backpack / Used For : Girls
School bags, casual backpacks, college backpacks, Kids Backpacks
",B0849MZF6Q,High Spirit Commercial Ventures Pvt Ltd
74,https://www.amazon.in/WILD-MODA-Womens-Shoulder-Turquoise/dp/B099PLT91X/ref=sr_1_83?crid=2M096C61O4MLT&keywords=bags&qid=1675355298&sprefix=ba%2Caps%2C283&sr=8-83,"WILD MODA Women's Shoulder Bag, Set of 1",849,4.3,"3,316","Material: High quality Waterproof Polyester material and nice eye catchy handbag
3 Big compartments with Zip closure and 6 Pockets that can easily carry your multiple utility for better organization.
Dimensions: Length: 35, Width: 18: Height: 27 cm, Closure: Zip; Strap Type: Shoulder
High quality soft Lining Anti-theft pocket with Top Zip Closer; Extra pockets for more space and easy to carry, the extra pocket on the inside comes with a closure so you can put all your important things inside like mobile, keys, jewellery, napkins, etc. Safely without the fear of losing them
",B099PLT91X,"WILD MODA, wildmoda@gmail.com"
75,https://www.amazon.in/Wesley-briefcase-professional-Briefcase-messenger/dp/B0BJVDN7VT/ref=sr_1_84?crid=2M096C61O4MLT&keywords=bags&qid=1675355298&sprefix=ba%2Caps%2C283&sr=8-84,Wesley office Laptop Bag briefcase notebook professional business 15.6 Inch Briefcase messenger sling Water resistant Laptop Bag Tablet Business Carrying Handbag for Women and Men (Charcoal Black),471,4.0,"1,064","Wesley laptop bag professional series 15.6 inch
Laptop compartment with dual zippered access and thick foam padding, protects your laptop very well.
Made of top fabric, designed to be very lightweight and slim, but stylish, practical and durable.
Luggage strap which helps to easily fix the briefcase on handle of your trolley
Trendy look and design. Dimensions: 17 x12.5x3.5 inch
",B0BJVDN7VT,Wesley
76,https://www.amazon.in/Shalimar-Capacity-Travel-Storage-Duffel/dp/B09TPHFMX7/ref=sr_1_83?crid=2M096C61O4MLT&keywords=bags&qid=1675355301&sprefix=ba%2Caps%2C283&sr=8-83,"SHALIMAR large capacity Travel bag / Storage bag / Move-in bags/ Duffel Bag - Strong, Durable , Foldable and Water Resistant ( Pack of 1 ) ( Blue )",247,4.1,270,"Easy Backpack to carry
Convenient Handles
Easy to fold and Store
Sturdy and Durable
Closure Type: Zipper; Strap Type: Adjustable; Handle Type: Web Handle
",B09TPHFMX7,"Vikrant Extrusion , Daman, Vikrant Extrusion , Daman"
77,https://www.amazon.in/VIP-Endura-Puller-Brown-Duffle/dp/B0B527KJQZ/ref=sr_1_84?crid=2M096C61O4MLT&keywords=bags&qid=1675355301&sprefix=ba%2Caps%2C283&sr=8-84,VIP Polypropylene 48 Cms Travel Bag(DFENDEBRN_Brown),899,4.3,334,"Padded, Comfortable Shoulder Strap
Easy access front pocket
Soft Grip handles
Stylish Design
",B0B527KJQZ,"VIP Industries Limited, DGP House, 88C, Old Prabhadevi Road, Prabhadevi, Mumbai 400025. India, VIP Industries Limited, DGP House, 88C, Old Prabhadevi Road, Prabhadevi, Mumbai 400025. India"
78,https://www.amazon.in/HP-Lightweight-300-Grey-Backpack/dp/B08CY44PVD/ref=sr_1_85?crid=2M096C61O4MLT&keywords=bags&qid=1675355301&sprefix=ba%2Caps%2C283&sr=8-85,HP Lightweight 300 Grey Laptops Backpack with Crafted Cable Pass Through and Padded Shoulder Straps,"1,002",4.1,67,"Protect your precious 15.6-inch laptop with the padded panels. Dual pocket protection design provides dual compartments for laptops and tablets.
Padded shoulder straps enable comfort even when the bag is at max load, plus a mesh padded back panel to support and keep you cool and comfortable even on extended use.
Special features like Back Trolly sleeve and Padded Grab handle are added advantages of the backpack.
Recharge your notebook and devices while you work or while they're connected to the bank inside your bag; or use the bank as a backup battery.
Rest easy with one-year limited warranty from the manufacturer.
",B08CY44PVD,Korrun India Pvt. Ltd.
79,https://www.amazon.in/Gear-Beige-Casual-Backpack-BKPTRMP520522/dp/B00VWM11HQ/ref=sr_1_86?crid=2M096C61O4MLT&keywords=bags&qid=1675355301&sprefix=ba%2Caps%2C283&sr=8-86,Gear Triumph 26L Water Resistant School Bag//Backpack/College Bag for Men/Women - Navy Blue,769,4.2,"5,375","Outer Material: Polyester, Inner Material: Polyester, Color: Navy Blue and Beige; Anti-sweat fabric on inner-side of shoulder straps
Wear Resistant: Wearproof, Water Resistance: waterproofDimensions: 32 cms x 18 cms x 47 cms (LxWxH)
Capacity: 26 liters, Weight: 0.534 Kg
Number of compartments: 3; Strap Type: Adjustable
Age Range Description: Adult; Pocket Description: Utility Pocket; Style Name: Traditional Backpacks; Closure Type: Zipper; Special Features: Back Padding
",B00VWM11HQ,"Gear Merchandise PVT LTD, Gear Merchandise PVT LTD E/12 West Chowbaga Gulshan colony KoLkata-700100 Contact 9830403366"
80,https://www.amazon.in/Motherly-Diaper-Bags-Travel-Basic/dp/B07PKQ3WJZ/ref=sr_1_87?crid=2M096C61O4MLT&keywords=bags&qid=1675355301&sprefix=ba%2Caps%2C283&sr=8-87,"Motherly Diaper Bags for Mom Travel Basic Edition (Navy Blue,Pack of 1)","1,516",4.5,"2,470","Capacity: 19 liters, Weight: 566gm
What’s new: Well-researched, upgraded fabric and hardware (zippers, rivets, gauge buttons) which is exclusively used to save you those extra bucks while maintaining the highest quality standards!! Light-weighted. Won’t add bulk and yet durable to sustain heavy weight.KEEP HOT WATER OR MILK WARM - Warm time of hot water or milk stored in the milk bottle pockets is 2 hours.
Pattern Name: Solid; Lining Description: Polyurethane; Age Range Description: Adult
",B07PKQ3WJZ,Motherly
81,https://www.amazon.in/Lenovo-Laptop-Backpack-15-6-Inch-GX40Q17225/dp/B075Y72PHZ/ref=sr_1_88?crid=2M096C61O4MLT&keywords=bags&qid=1675355301&sprefix=ba%2Caps%2C283&sr=8-88,Lenovo Casual Laptop Backpack B210 15.6-inch(39.6cm) Water Repellent Black,"1,011",4.2,"53,052","Compatible With 15.6"" Laptop : The Lenovo B210 Backpack fits up to 15.6 inch laptop. Dimensions: 34cm x 15cm x 45.5cm; Weight: 453g.
High Quality, Durable and Water Repellent Fabric : This backpack features in durable snow yarn polyester fabric and streamlined design with a padded interior to protect notebooks and important items
Convenient Travel : Adjustable shoulder strap and padded laptop compartment together with a quilted back panel make it comfortable for all-day use. Fits Up To (L x D x H) 255 x 22 x 362 mm
Conveniently Placed Padded Laptop Compartments and Packets : The padded interior helps protect notebooks and important items. Quick access zippered front pocket for added storage. A quilted back panel make it comfortable for all-day use.
High Quality, Casual yet Stylish Design : Very attractive and perfect for school, travel and outdoor activities. The perfect backpack for those needing stylish all-day protection for their laptop
There might be minor color variation between actual product and image shown on screen due to lighting on the photography
In the Box : 15.6-inch Backpack
Country of Origin: China
",B075Y72PHZ,"Lenovo, Ferns Icon, Level, 2, Outer Ring Rd, Doddanekundi, Mahadevapura, Bengaluru, Karnataka 560157"
82,https://www.amazon.in/Fostelo-CATLIN-Womens-Handbag-Maroon/dp/B079MD5F7R/ref=sr_1_89?crid=2M096C61O4MLT&keywords=bags&qid=1675355301&sprefix=ba%2Caps%2C283&sr=8-89,Fostelo Handbag For Women And Girls | Ladies Purse Faux Leather Satchel Bag | Woman Gifts | Wedding Gifts For Women | Women 3 Compartments Bag | Travel Purse Hobo Bag | 5 Pockets Shoulder Bag,498,4.1,"8,913","Warranty :- 1 Year Warranty On Manufacturing Defects. 100% Quality Assured.
Dimensions (In Inches) :- 9"" Tall X 14"" Wide X 4"" Deep
Compartments :- 3 Zip Compartments And 1 Back Zip Pocket
Material :-100% PU | Colour :- Maroon
",B079MD5F7R,"Fostelo, Promunt Online Services Pvt Ltd 6-2-119/1/A, New Bhoiguda Secunderabad Hyderabad Telangana - 500003"
83,https://www.amazon.in/SIDRUM-Shoulder-Adjustable-Compatible-Mirrorless/dp/B09SHTBFQF/ref=sr_1_90?crid=2M096C61O4MLT&keywords=bags&qid=1675355301&sprefix=ba%2Caps%2C283&sr=8-90,"SIDRUM DSLR/SLR Camera Shoulder Bag Case with Adjustable Shoulder Strap & Rain Cover, Compatible for Nikon, Canon, Sony Mirrorless Cameras - Waterproof - Breathable - Anti Shock (Orange-Black-Large)",949,4.4,810,"Dimension : 10'' x 6'' x 8'' , Internal size: 9'' x 5'' x 7'' ; Fits 1 camera +1 spare lens + mobile phone + filter + SD card.
Multiple Accessory Pockets to organize extra batteries, memory cards, cables, lens caps, or other small accessories.
Detachable shoulder strap is adjustable and can also be worn cross-body. Made from durable polyester material, outfitted with reinforced padded carry handle.
The camera compartment is fully padded with closed cell dense foam padding to protect valuable cameras and accessories.
Package Includes: 1*waterproof Camera Case Bag 1*Shoulder Strap 1*Rain Cover 2*Spacer Pad
",B09SHTBFQF,"Sidrum, Pack Logic Solutions , #9 Sri Balaji Nagar, Puliyambedu , Thiruverkadu , chennai - 600077, contact - 9597287686"
84,https://www.amazon.in/YuvKuz-TM-Infocus-Digitizer-Assembly/dp/B07MXNWTB2/ref=sr_1_93?crid=2M096C61O4MLT&keywords=bags&qid=1675355301&sprefix=ba%2Caps%2C283&sr=8-93,Lavie Women's Nova Tote Bag | Ladies Purse Handbag,824,4.2,"7,318","Lavie Malnov tote is a stylish offering for ladies. It is durable, light weight and super spacious. Made from vegan leather, this large hand bag comes in Herringbone, Woven and Croco texture pattern at the front.
Woven Texture- 45 cm in length x 12 cm in width x 35 cm in height
Malnov hand bag has a top zip closure for safety and comfort. The interior has 2 slip pockets along with 1 zip pocket providing plenty of storage space for keeping phone, portable charger, keys, hairbrush, wallet, sunglasses, sanitizer and a pair of clothes.
This latest tote is perfect for women to carry for a weekend getaway or even a day at the mall for shopping. It can be paired with formal pants & blazer as well as with a basic crop top and jeans. This spacious and sturdy bag makes for a perfect gift for all your occasions.
The bag has a well stitched inner lining and high quality zippers for easy accessibility and storage.
",B07MXNWTB2,"Bagzone Lifestyle Pvt Ltd, Bagzone Lifestyle Pvt Ltd | | LAVIE 402, Ackruti Star, MIDC Central Road, Andheri East, Mumbai – 400093"
85,https://www.amazon.in/House-Quirk-Hanging-Toiletry-Organizer/dp/B072MH8KBB/ref=sr_1_94?crid=2M096C61O4MLT&keywords=bags&qid=1675355301&sprefix=ba%2Caps%2C283&sr=8-94,"House of Quirk Hanging Travel Toiletry Bag, Waterproof Dopp Kit for Shaving Makeup Accessories, Men Cosmetic Organizer with Large Capacity, for Gym, Camping - Black",399,4.0,"1,922","Size - 25 x 15 x 13.5 cm. A large compartment and Mesh pockets to keep all personal belongings (Shaving Kit, Cosmetic, Shampoo, Facial Cleanser, Toothbrush, etc.) in one place; Suitable for personal Travel
Water-resistant material -- High Quality water-resistant fabric (durable and Lightweight); strong hanging hook, best zipper and high standard workmanship to ensure your toiletry bag.
Handy User-friendly design -- Main compartment features mesh pockets and main storage room for large item organize; Zippered front pocket adding extra storage
Easy to carry and hang -- A built-in strong hanging hook, easy to keep on towel racks, shower rods or on door knobs. Durable carrying handle convenient to carry or hung up.
Multiple Applications -- Ideal for vacation, business, gym, camping or outdoor activity.
",B072MH8KBB,Inventure Retail
86,https://www.amazon.in/Baggit-Womens-Hobo-Handbag-Green/dp/B097C2T2DS/ref=sr_1_95?crid=2M096C61O4MLT&keywords=bags&qid=1675355301&sprefix=ba%2Caps%2C283&sr=8-95,Baggit Women's PEPSI Sling Bag,812,4.3,"1,923","Faux Leather material
Green colored Hobo Handbag
Strap type : Single
Zip type closing mechanism.
Made in India
",B097C2T2DS,"Baggit India Pvt Ltd, Baggit India Pvt Ltd"
87,https://www.amazon.in/Alifiya-Polyester-MacBook-Charger-Grey_L26/dp/B09GP79C4C/ref=sr_1_96?crid=2M096C61O4MLT&keywords=bags&qid=1675355301&sprefix=ba%2Caps%2C283&sr=8-96,Alifiya Polyester MacBook Laptop Sleeve Bag 16 Inch with Charger Pouch (Grey_L26),384,4.2,90,"Material: Polyester Fabric PVC Coated (outer), Shock Resistance EPE Layer (middle), Lining Layer (inner); Laptop Sleeve Dimensions: 16 x 1.2 x 11 inch (L × W × H); Charger Pouch Dimension: 8 x 2.1 x 4.3 inch (L × W × H); Sleeve Weight: 175 grams; Pouch Weight: 80 grams
Compatible: 16 inch Macbook and any other Laptops
Warranty: Manufacturer- 1-year domestic warranty
Water Resistance: Yes; Dustproof: Yes; Shock Resistance: Yes
Special feature: Number of the compartment - 1; Slim desgin; Easy to carry itself or Glid into your other backpack; Charger Pouch - carry charger and other small acessories with ease
",B09GP79C4C,"Alifiya, Alifiya, sidhpur highway, Beside National auto service center, Kakoshi char rasta, pin-384151, Gujarat"
88,https://www.amazon.in/Baggit-Womens-Satchel-Handbag-Grey/dp/B098TKJG1L/ref=sr_1_97?crid=2M096C61O4MLT&keywords=bags&qid=1675355301&sprefix=ba%2Caps%2C283&sr=8-97,Baggit Women's Sling Bag (Grey),837,4.3,778,"Faux Material material
Grey colored Satchel Handbag
Strap type : Single
Zip type closing mechanism.
Made in India
",B098TKJG1L,"Baggit India Pvt Ltd., Baggit India Pvt Ltd., Shree Arihant Compound, Kalher, Bhiwandi, Thane - 421302"
89,https://www.amazon.in/TRAWOC-Backpack-Trekking-Rucksack-Warranty/dp/B0847PGZZM/ref=sr_1_98?crid=2M096C61O4MLT&keywords=bags&qid=1675355301&sprefix=ba%2Caps%2C283&sr=8-98,TRAWOC 80L Travel Backpack for Outdoor Sport Camp Hiking Trekking Bag Camping Rucksack HK007-PARENT,"2,380",4.4,"6,734","Fit Type: Relaxed
SMART & TRENDY LOOKS: This Large 81 x 33 x 27 Cm rucksack bag is smart, trendy and stylish in looks. The multipurpose rucksack bacpack looks smart, athletic and venturesome and the blend of grey and red makes it appear exquisite. Your hiking trips, mountaineering experience cannot get completed without this amazing trekking backpack.
",B0847PGZZM,"TRAWOC, TRAWOC Gears, Customer care: mail@trawoc.com, Whatsapp: 86067 96695"
