,url,name,price,rating,reviewerCount,description,asin,manufacturer
214,https://www.amazon.in/Roller-Skating-Inline-Skates-Adults/dp/B08C47SFYB/ref=sr_1_228?crid=2M096C61O4MLT&keywords=bags&qid=1675355327&sprefix=ba%2Caps%2C283&sr=8-228,"jaspo Roller Skating Bag, Quad & Inline Skates (Water Resistant), Casual/Office/College Book Backpack Computer/Laptop Bag for Both Kids & Adults Travel Backpack",284,3.5,56,"🎒 HIGH QUALITY MATERIAL: The Jaspo skate bag is made of 1200D nylon fabric and strengthen framework, provided strong tear and deformation resistant. Skate bag comes in size (11 x 5.5 x 15 inch) weight 300gm. Ideal for storing Skates + Protective Gear (knee guard, elbow guard +wrist guard) & Adjustment key.
🎒 PADDED SHOULDER STRAP: Possessing an EVA padded mesh back panel, it can keep the boots from jabbing you in the back. The padded backpack straps with adjustable system never dig into the shoulders and it manages to stay put against your back regardless of how much you’re moving around, allowing the ski boot bag to be taken from place to place with general ease.
🎒 LARGE CAPACITY: Big enough to hold a pair of quads (traditional) skates or a pair of small inline skates, without being too big to actually carry. The perfect size for a trip to the rink or park.
🎒 COMPARTMENT: 1 large zippered pocket + 1 front zippered pocket for carry accessories for easy access and + 2 side mesh pockets for towel & sipper.
🎒 USAGE: Ideal for storing skates/ skating helmets, protective gear, adjustment keys and other accessories. Unisex bag: it can also be used for carrying other products like books, toys, games or any other kids’ sports stuff
",B08C47SFYB,"jaspo, jaspo industries ,11 new gautam nagar, kapurthala road, jalandhar"
215,https://www.amazon.in/LL-LEATHER-LAND-DESIGNER-BAGS/dp/B0BD4TTDHD/ref=sr_1_227?crid=2M096C61O4MLT&keywords=bags&qid=1675355330&sprefix=ba%2Caps%2C283&sr=8-227,LL LEATHER LAND DESIGNER BAGS Sling Bag_SLG_90,299,4.0,"1,547","Lethereette SLing bag
Stylish Sling in 9 inches height,10 inches length and 4 inches width
Water Proof
Adjustable strap
",B0BD4TTDHD,"LL LEATHER LAND DESIGNER BAGS, LL Leather Land Designer Bags,Customer Support (9849818415)"
216,https://www.amazon.in/Roller-Skating-Inline-Skates-Adults/dp/B08C47SFYB/ref=sr_1_228?crid=2M096C61O4MLT&keywords=bags&qid=1675355330&sprefix=ba%2Caps%2C283&sr=8-228,"jaspo Roller Skating Bag, Quad & Inline Skates (Water Resistant), Casual/Office/College Book Backpack Computer/Laptop Bag for Both Kids & Adults Travel Backpack",284,3.5,56,"🎒 HIGH QUALITY MATERIAL: The Jaspo skate bag is made of 1200D nylon fabric and strengthen framework, provided strong tear and deformation resistant. Skate bag comes in size (11 x 5.5 x 15 inch) weight 300gm. Ideal for storing Skates + Protective Gear (knee guard, elbow guard +wrist guard) & Adjustment key.
🎒 PADDED SHOULDER STRAP: Possessing an EVA padded mesh back panel, it can keep the boots from jabbing you in the back. The padded backpack straps with adjustable system never dig into the shoulders and it manages to stay put against your back regardless of how much you’re moving around, allowing the ski boot bag to be taken from place to place with general ease.
🎒 LARGE CAPACITY: Big enough to hold a pair of quads (traditional) skates or a pair of small inline skates, without being too big to actually carry. The perfect size for a trip to the rink or park.
🎒 COMPARTMENT: 1 large zippered pocket + 1 front zippered pocket for carry accessories for easy access and + 2 side mesh pockets for towel & sipper.
🎒 USAGE: Ideal for storing skates/ skating helmets, protective gear, adjustment keys and other accessories. Unisex bag: it can also be used for carrying other products like books, toys, games or any other kids’ sports stuff
",B08C47SFYB,"jaspo, jaspo industries ,11 new gautam nagar, kapurthala road, jalandhar"
217,https://www.amazon.in/Gear-Green-Casual-Backpack-BKPECOBP40503/dp/B019HA8DQQ/ref=sr_1_229?crid=2M096C61O4MLT&keywords=bags&qid=1675355330&sprefix=ba%2Caps%2C283&sr=8-229,Gear Eco4 19L Water Resistant School Bag//Backpack/College Bag for Men/Women - Navy Blue,489,4.0,"4,119","Outer Material: Polyester, Color: Green and Grey
Wear Resistant: Wear resistant, Stain resistant, Water Resistance: Water resistant
Dimensions: 46 cms x 32 cms x 13 cms (LxWxH) , Capacity : 18 Liters
Number of Compartments: 2; Warranty Type: Manufacturer; 1 Year from the date of purchase
Pocket Description: Utility Pocket; Closure Type: Zipper; Age Range Description: Adult; Special Features: Back Padding
",B019HA8DQQ,"Gear Merchandise PVT LTD, Gear Merchandise PVT LTD E/12 West Chowbaga Gulshan colony KoLkata-700100 Contact 9830403366"
218,https://www.amazon.in/wooum-Resistant-Material-Messenger-Compartment/dp/B0BQFHN15L/ref=sr_1_230?crid=2M096C61O4MLT&keywords=bags&qid=1675355330&sprefix=ba%2Caps%2C283&sr=8-230,wooum Water Resistant Material Sling Bag/One Side Bag/Shoulder Bag/Messenger Bag/Office Messenger Bag/Travel Side Bag with 14.1 Inch Laptop Compartment -,"474<span class=""a-price-decimal"">.</span>",4.0,201,"Product Size -14x11x4 Inch / 35.56 x 28 x 10 cm , Product Color - Dark Grey , Materil Type Name - Khadi Fabric.Smooth Zipper and Flap Closure. Material Feature - Water and Scratch Resistance
Design for 14.1 inch laptop with Laptop compartment with dual zippered access and thick foam padding, protects your laptop very well. Made of top fabric, designed to be very lightweight and slim, but stylish, practical and durable.
It's a perfect messanger sling bag for working, short traveling, school and daily using.Adjustable Crossbody Shoulder Strap: Carry your crossbody bag securely thanks to the fully adjustable strap.
Number of Compartments: 1 zipper and 1 open Pocket on flap & 2 Zipper Compartment inside. and seperate Laptop padded Compartment inside the zipper compartment.
Crossbody Lapotop Messenger Bag Comes with 14.1 Inch Laptop Compartment and 3 Zip Compartment and One Velcro Pocket for your electronic gadget accessories.
Made in India product , Consisting of good stitching and Smooth zippers, this sling ensures long lasting durability & strength.You can use this bag as a messenger bag, shoulder bag, suitable for your office, college, outdoor travels, university, meeting, and business for everyday use.
",B0BQFHN15L,
219,https://www.amazon.in/F-Gear-Enzo-Red-Sports-Waist-Bag/dp/B0862LF7HS/ref=sr_1_231?crid=2M096C61O4MLT&keywords=bags&qid=1675355330&sprefix=ba%2Caps%2C283&sr=8-231,F Gear Enzo Sports Waist Bag (.Red),197,4.2,751,"One zippered compartment suitable for keys/napkins/wallet/mobile etc.
One inside pocket with two small sleeves for credit card/passport etc. This fanny pack is suitable for only 250ml bottle.
This fanny pack is water resistant.
Premium YKK Japanese Zippers& sliders with an adjustable waist strap.
Comes with The F Gear promise of quality and durability.
",B0862LF7HS,"F Gear, Uber Fashion Merchandise Pvt. Ltd. No. 17G/46-3 & 17G/46-3-1 , 1st & 2nd Floor, Industrial Suburb, 2nd Stage, Yeshwantpur, Next to Sapna Books on MEI road, Bangalore – 560 022. INDIA Tel: 9066161590"
220,https://www.amazon.in/AirCase-C26-Messenger-Laptop-Shoulder/dp/B07P417566/ref=sr_1_232?crid=2M096C61O4MLT&keywords=bags&qid=1675355330&sprefix=ba%2Caps%2C283&sr=8-232,"AirCase Laptop Messenger Bag Case Cover Pouch for 13.3-Inch, 14-Inch Laptop Bag for Men & Women (Blue)",949,4.1,"2,565","Innovative Design: Utility of a Messenger Bag with Convenience of a Laptop Sleeve. Built with Premium Nylon Material which is waterproof with Impact resistant foam cushion and imported soft fur lining with 3D Foam Cushion Around which prevents scratches, Premium and Exquisite Zipper Closure.
Convenient, Comfortable and Elegant: One Front Zipper Pocket to organize accessories has ample storage for your Power bank, Phone, charger, Tabs, cable, Pen, Notebook, etc. Comes with Adjustable & Removable Shoulder Strap for easy portability.
A much Safer Way to Carry Laptop: The bag is made of soft and environmentally friendly materials with reinforced edges and good padding of the main compartment offer well protection for your laptop.
COMPATIBLE for with all the major brands of Laptop Upto 13.3-Inch to 14-Inch Laptops.
Designed for most 13.3-Inch to 14-Inch Laptops and Ultrabook’s and easy to use, practical design and exquisite workmanship.
",B07P417566,AirCase
221,https://www.amazon.in/SACCI-MUCCI-Allamanda-Lightweight-SM1-10_magnolia/dp/B09TDNZ88Z/ref=sr_1_233?crid=2M096C61O4MLT&keywords=bags&qid=1675355330&sprefix=ba%2Caps%2C283&sr=8-233,"SACCI MUCCI Women's Rainbow Sling Bag, Handmade Bags for Females - 100% Vegan Leather and Coated Duck canvas Fabric, Lightweight and Durable",449,4.3,557,"Beautiful colors and carefully crafted to be functional - It has beautiful print and ample space to keep your phone, card, cash, cosmetics and other essentials you need to carry on your day out, it will give you maximum storage without compromising your style statement.
It is featured with adjustable strip which provides comfort & convenience while walking or travelling and top zip closure for easy opening & closing of the bag.
This pretty sling bag has single large compartment storage space for carrying all your daily essentials. The compartment is also featured with zippered pocket inside to keep your card and cash separate and the bag manufactured using high grade faux leather and Pure Indian Cotton Canvas material.
This cute trendy cross body bag is featured with wide bottom base or footed bottom with gold metal logo and fittings you can complement your contemporary look with this stylish sling/cross body bag. It is perfect handbag to carry at work or for casual and party look.
Handcrafted/Handprinted- Each products are unique.
",B09TDNZ88Z,We Make Memories
222,https://www.amazon.in/Half-Moon-Travelling-Compartment-Polyester/dp/B09CGZ2W28/ref=sr_1_234?crid=2M096C61O4MLT&keywords=bags&qid=1675355330&sprefix=ba%2Caps%2C283&sr=8-234,Half Moon 55 litres Travelling Laptop Bag/Rucksack Backpack for Luggage Travel Journey Trekking Hiking Bags for Men Women Boys and Girls with Laptop Compartment & Rain Cover (Polyester Navy),979,4.0,903,"The large and spacious main compartment has plenty of room for all your travel essentials.
Durable construction and reinforced bar-tacks on pressure points ensure the backpack can withstand the rigors of travel.
The included rain cover keeps your gear dry in wet weather.
The dedicated laptop compartment and multiple pockets provide convenient storage and organization options.
The hip strap helps distribute the weight of the backpack more evenly, reducing strain on the shoulders and back.
",B09CGZ2W28,Half_Moon
223,https://www.amazon.in/Kuber-Industries-Transparent-Waterproof-F_26_KUBBMART017038/dp/B08WK5WQ3K/ref=sr_1_237?crid=2M096C61O4MLT&keywords=bags&qid=1675355330&sprefix=ba%2Caps%2C283&sr=8-237,"Kuber Industries Large Size Crystal Clear Plastic Cosmetic Bags Travel PVC Vinyl Toiletry Bag, Zipper Large Transparent Waterproof Make-Up Case Organizer Bag (Blue) (F_26_KUBBMART017038)","244<span class=""a-price-decimal"">.</span>",3.8,20,"Package Contents: 1 Transparent Travel Toiletry Bag
Material : PVC, Color : Blue
Dimension: 30cm x 20cm x 15cm
Easily Organize, Top Efficiency : The clear pouch has one main compartment with a heavy-duty double zipper that makes everything simpler to use. This way, you will never lose your makeup or toiletries in complicated carrying bags. Also make use of external pocket
WATERPROOF PVC material: Take it to the pool or beach, throw in a larger tote or travel bag & know your items are protected from moisture or sand! Easy to wipe clean
",B08WK5WQ3K,"Kuber Industries, KUBER INDUSTRIES, JALAJ G1-184 & 185, EPIP, BANK OF BARODA,LANE, GARMENT ZONE, SITAPURA,JAIPUR,(RAJ) 302012, Mob:-8505030382"
224,https://www.amazon.in/Lino-Perros-quilted-sling-bag/dp/B09MRXJ9RY/ref=sr_1_238?crid=2M096C61O4MLT&keywords=bags&qid=1675355330&sprefix=ba%2Caps%2C283&sr=8-238,Lino Perros quilted sling bag,899,4.0,46,"Handbag
ladies
",B09MRXJ9RY,"SUMITSU APPAREL PVT. LTD, Plot No. 324, Phase IV, Sector 18, Gurugram, Haryana, SUMITSU APPAREL PVT. LTD, Plot No. 324, Phase IV, Sector 18, Gurugram, Haryana , 122016, Ph. 0124 234 0205"
225,https://www.amazon.in/Wildcraft-Green-Casual-Backpack-11650-Green/dp/B079DV66TY/ref=sr_1_239?crid=2M096C61O4MLT&keywords=bags&qid=1675355330&sprefix=ba%2Caps%2C283&sr=8-239,Wildcraft 29.5 Ltrs Green Casual Backpack (11650-Green),995,4.2,310,"Outer Material: Polyester, Color: Green
Capacity: 29.5 liters; Dimensions: 7.5 inches x 13 inches x 18.5 inches (LxWxH)
Number of compartments: 2
Warranty type: Manufacturer; 5 years manufacturer warranty is non-transferable and valid for 5 years from the original date of purchase
",B079DV66TY,Wildcraft
226,https://www.amazon.in/Isle-Locada-Hidesign-Womens-Sling/dp/B07L6NGWLP/ref=sr_1_240?crid=2M096C61O4MLT&keywords=bags&qid=1675355330&sprefix=ba%2Caps%2C283&sr=8-240,Hidesign Women Sling Bag (Blue),"1,499",4.4,250,"Leather material blue colored sling bag
15.2 centimeters height x 21.5 centimeters length x 5.8 centimeters width
Zip closure with handle
1 compartment
1 year domestic warranty against manufacturing defects
Do not expose to extreme heat
",B07L6NGWLP,"Hidesign India Private Limited - Isle Coco By Hidesign, Hidesign India Private Limited - Isle Coco By Hidesign"
227,https://www.amazon.in/Womens-Lattice-Office-leather-adjustable/dp/B07VNMWWRX/ref=sr_1_241?crid=2M096C61O4MLT&keywords=bags&qid=1675355330&sprefix=ba%2Caps%2C283&sr=8-241,ZOUK Black Printed Handmade Vegan Leather Women's Office Bag for 15.6 inch Laptop with Double Handles - Lattice Lace,"1,699",4.4,"1,693","COMPATIBILITY: Our Stylish Office Bag for women is an ideal laptop bag, handbag or a Professional Bag. It can fit a laptop of upto 15.6 inches and is perfect for Macbook, Chromebook, iPad, Tablet, Hp, Lenovo, Dell etc. Dimensions: 16 x 13 x 4 inch.
",B07VNMWWRX,"Seaturtle Pvt. Ltd., Thakur Compound, 2nd Floor, 3, USV Lane, Deonar, Mumbai, Maharashtra 400088"
228,https://www.amazon.in/Isle-Coco-Hidesign-Womens-Sling/dp/B07L6N38Y3/ref=sr_1_242?crid=2M096C61O4MLT&keywords=bags&qid=1675355330&sprefix=ba%2Caps%2C283&sr=8-242,Hidesign Women Sling Bag (Silver),"2,299",4.3,70,"Leather material Grey colored sling bag
21.5 centimeters height x 24 centimeters length x 7.5 centimeters width
Zip closure with handle
1 compartment
1 year domestic warranty against manufacturing defects
Do not expose to extreme heat
",B07L6N38Y3,Isle Locada by Hidesign
229,https://www.amazon.in/AirCase-Anti-Gravity-Ergonomic-Technology-Protected/dp/B0B87NB61B/ref=sr_1_243?crid=2M096C61O4MLT&keywords=bags&qid=1675355330&sprefix=ba%2Caps%2C283&sr=8-243,"AirCase Anti-Gravity Backpack for Men & Women, Weight Reducing 15.6” Laptop Bag for Travel & Office, Ergonomic Technology for Posture & Muscle Support, Patent Protected, In-built Shock Absorber","4,099",3.9,34,"⦿WORLD’S GREATEST BACKPACK: The AirCase Anti-Gravity Backpack has been crafted using a patented technology based on ancient load-bearing practices & modern lab-tested functionalities. The Bag that Defies Gravity - there is nothing like it.
⦿PATENTED ANTI-GRAVITY TECHNOLOGY: This Backpack has a smart Inbuilt Pressure Detector System. As the weight inside the backpack increases, the Elastic Shoulder Straps suspend open, changing the weight distribution and Reducing the Load on the Back & Neck muscles. The AirCase Anti-Gravity Backpack reduces muscle pressure by 25% as compared to a normal backpack.
⦿TECH IN ACTION: Guarded Lower back Support & Posture control enabled by Premium Grade Padding at the back. Zero jerk or sudden movement to the muscles through 4-Point Independent Suspension System.
⦿HOLISTICALLY DESIGNED: This Tech Packed Bag is Waterproof, has a Minimalist Exterior design that is class apart. It features multiple inner pockets & compartments for smart organisation of all your Office and Travel Essentials.
⦿MADE FOR A BETTER LIFE: This Bag is ideal for travellers (both Business and Leisure), bikers and hikers.
",B0B87NB61B,"AirCase, Istuff365, Godown No.H-3, Dharam Complex, Thane-421302"
230,https://www.amazon.in/Lavie-Betula-Womens-Tote-Black/dp/B08HWFWGNX/ref=sr_1_244?crid=2M096C61O4MLT&keywords=bags&qid=1675355330&sprefix=ba%2Caps%2C283&sr=8-244,Lavie Women's Betula Medium Tote Bag | Ladies Purse Handbag,"1,037<span class=""a-price-decimal"">.</span>",4.1,"18,210","Betula small tote has a top zip closure to keep your essentials in place. The bag has spacious compartment with multi-utility pockets, providing plenty space for keeping phone, portable charger, keys, hairbrush, wallet, sunglasses, sanitizer etc.
The main compartment is divided into 2 with a zippered divider pocket. It also has slip pockets alongside 1 zip pocket inside providing options for multiple storage. One should also not forget the zip pocket outside the bag.
Made from high quality and soft material, this handbag features a well-stitched inner lining for easy accessibility and storage.
Functional and trendy, this handbag from Lavie will carry all your essentials for your day.
It has a clean design making it good for everyday use
",B08HWFWGNX,"Bagzone Lifestyle Pvt Ltd, Bagzone Lifestyle Pvt Ltd | | LAVIE 402, Ackruti Star, MIDC Central Road, Andheri East, Mumbai – 400093"
231,https://www.amazon.in/Hoteon-Backpack-Anti-Theft-Earphone-Resistant/dp/B08HM4TQZZ/ref=sr_1_243?crid=2M096C61O4MLT&keywords=bags&qid=1675355333&sprefix=ba%2Caps%2C283&sr=8-243,"Golden Wolf Laptop Bag Anti-theft Backpack with Lock College School Laptop Backpack with Rain Cover Water Resistant Business Backpack with USB Port for 15.6-inch Laptop 25 L Travel Bag for Women and Men Gifts, Dark Grey","1,999",4.4,"3,186","[Built in Rain Cover]-- Matching water-resistant rain cover included, with a strap to attach it to your backpack, so that you can use this bag in any season and all weather conditions, making it a great choice for outdoor use.
[SAFETY & FREE YOUR HAND]-- This antitheft business travel laptop backpack comes with a Locker so you never have to worry about someone stealing your laptop, ipad,file and other valueablesPlease reset the password of the backpack and remember the new password.if you forget the password,Please contact us by sending internal information on Amazon.LUGGAGE STRAP allows backpack to fit on luggage/suitcase. Durable metal zippers close and open smoothly, ensuring a long-lasting usage everyday
[MULTI-FUNCTION]-- No need to worry about your phone battery running out with the useful USB port and charging cable, (power bank not included). There is also a headphone jack so you can listen to your favourite music on the go
[COMFORTABLE]-- Ideal for work, high school, college, university, travelling, hiking, cycling or camping with its back padding made of breathable mesh and foam to keep you cool, and lining on the shoulder straps to prevent backaches and cutting into your shoulders
[Multi-Level Organizer]-- The backpack has a front zipper pocket for the ID card, Sanitizer,masks, House keys, Pen. First compartment with pockets for the earphones, pens, notebook, Fitness Band. 2 Year Warranty aganist manufracturing defects caused by workmanship. 2 year warranty DOES NOT cover natural wear or tear and damage due to mishandling.
",B08HM4TQZZ,ah arctic hunter
232,https://www.amazon.in/Genie-Spritz-Daypack-Fashion-Backpack/dp/B083ZDT8SD/ref=sr_1_244?crid=2M096C61O4MLT&keywords=bags&qid=1675355333&sprefix=ba%2Caps%2C283&sr=8-244,"Genie Spritz Daypack 14 inch, Stylish and Trendy College backpacks for girls, Water Resistant and Lightweight Mini Bags for Travelling Purpose. Latest Collection of Backpack for women (Rose)",349,4.2,"2,287","Outer Material : Nylon Twill, Color:Rose, Capacity : 13.5 Litres, Dimension : 28.5 X 13.5 X 35 Cm, Number Of Compartments : 1, Laptop Compatibility : No, 1 Large Volume Compartment That Can Fit In A A4 Sized Notebook
Extremely Light Weight Making It Easy To Carry; Twill Material Lends A Shine To The Daypac. It Is Super Soft To Touch And Makes The Daypac Durable
This Daypack Has A Top Opening Zipper That Makes It Easy To Carry Essentials
It Is Also Water Resistant So You Don'T Have To Worry About Spills
Special Features: Lightweight; Age Range Description: Adult
",B083ZDT8SD,"Safari, Safari"
233,https://www.amazon.in/POLESTAR-Navyorg-Casual-bagpack-Backpack/dp/B0844R2GMK/ref=sr_1_245?crid=2M096C61O4MLT&keywords=bags&qid=1675355333&sprefix=ba%2Caps%2C283&sr=8-245,"POLESTAR Space 34 L Bag for College, School, Office, Casual Multipurpose Backpack with 15.6"" Laptop Compartment, Water Resistant, Unisex Design, Stylish & Durable, 1 Year Warranty",549,4.0,"6,046","?DIMENSIONS: 30 Cm x 23 Cm x 47 Cm, CAPACITY: 34 Litres; ?NUMBER OF COMPARTMENTS: 3 full size compartments, 1 front zippers & 2 side pockets, LAPTOP COMPARTMENT: Padded laptop compartment with elasticated strap lock, LAPTOP SIZE: 13 to 15.6 inches
?MATERIAL: Polyester, Water Resistant, COLOR: Navy Blue & Orange
?SPECIAL FEATURES: Ergonomic design, lightweight, padded breathable mesh back with adjustable S-Curved shoulder straps which protects the backbone and help to relieve stress on shoulders, smooth & durable zippers, padded haul loop, 2 bottle/ umbrella easy access pockets, 1 front tiffin pocket, rain cover in the side pocket
?CONSUMER: Suitable for men, women, students, boys & girls, can be used as school, college, office or day travelling backpacks, WARRANTY: 12 Months, Make in India product
Special Features: Bottle Holder; Style Name: Daypack Backpacks; Pattern Name: Solid; Compartment Description: Up To 15 Inches
",B0844R2GMK,"POLESTAR, JAI AMBAY ENTERPRISES ,03AAFFJ0421M1ZQ, B -29 ,Sports & Surgical complex,Kapurthala Road, Jalandhar Punjab 140021 India . +91 9914112308 , polestarbags@gmail.com"
234,https://www.amazon.in/Gear-Vintage2-Leather-Backpack-LBPVG2LTH0501/dp/B07G4HH78P/ref=sr_1_247?crid=2M096C61O4MLT&keywords=bags&qid=1675355333&sprefix=ba%2Caps%2C283&sr=8-247,Gear Vintage2 28L Faux Leather Water Resistant Anti Theft Laptop Bag/Backpack for Men/Women-Navy,999,4.4,"3,057","Outer material: Synthetic, color: navy; Waterproof
Capacity: 28 liters; Weight: 600 grams; Dimensions: 48 cms x 33 cms x 18 cms (LxWxH)
Number of compartments: 2
Laptop compatibility: Yes, laptop size: 16strap type: adjustable
Pocket Description: Utility Pocket; Style Name: Traditional Backpacks; Closure Type: Zipper; Age Range Description: Adult; Special Features: Back Padding
Concealed quick access Pockets on back panel ,Adjustable Anti sweat padded Shoulder straps , Padded Laptop sleeve,3 External Pockets, Padded Back Panel Cushioned with Anti Sweat Fabric,Embedded Organizer , USB and Headphone cable slot .
",B07G4HH78P,"Gear Merchandise PVT LTD, Gear Merchandise PVT LTD E/12 West Chowbaga Gulshan colony KoLkata-700100 Contact 9830403366"
235,https://www.amazon.in/Leatherette-Executive-messenger-multiple-compartments/dp/B099NM8621/ref=sr_1_248?crid=2M096C61O4MLT&keywords=bags&qid=1675355333&sprefix=ba%2Caps%2C283&sr=8-248,"Zipline Synthetic Leather Executive SMALL messenger bag Briefcase for upto 13"" Laptop/Tablet for men women with multiple compartments (1-Tan Bag)",938,3.9,336,"Plenty of Space & Padded Laptop Sleeve - The laptop bag is a decent in size that fits 13''MacBook Pro.Main compartment with zipper closure outside;The inside consist of a divider,a 13''laptop can easily fit inside and a built in divider between the inside compartment to help separate them all.1 zipper pocket inside for significant articles such as wallets and identification documents, inner slip pockets,1 back slot is perfect for an iPad mini.
",B099NM8621,"Atulitu Agency, ,251/3364, Tagore Nagar - 1, Vikhroli East, Mumbai - 400083 (9820078070), Atulitu Agency, 251/3364, Tagore Nagar - 1, Vikhroli East, Mumbai-400083 (9820078070)"
236,https://www.amazon.in/Polyester-Crossbody-Messenger-Business-Spacious/dp/B09TL193PL/ref=sr_1_249?crid=2M096C61O4MLT&keywords=bags&qid=1675355333&sprefix=ba%2Caps%2C283&sr=8-249,CRALOFT Polyester Side Bag For Men/Sling Bag/Crossbody Tablet Messenger Bag For Office Business Travel (Extra Spacious),529,4.3,272,"DIMENSIONS: 7.5 x 3.5 x 11.5 inch (L x W x H); NOTE - You can’t use it as a tiffin bag & Image of the sling shoulder bag may appear bigger or smaller than real, so kindly check the dimensions before placing an order
MATERIAL & COMPARTMENT  - Craloft sling bag for men made up of polyester fabric with 4 compartments (3 pockets & 1 additional tablet compartment)
ADJUSTABLE BELT - The soft adjustable belt of this crossbody sling bag satisfy your different length need
TABLET COMPARTMENT - Carry up to a 11-inch iPads / samsung galaxy / lenovo / realme pads tablets in a specific additional secure 8mm layer section, that protects your device from various elements
Craloft side bag looks compact but is too spacious for carrying all necessities like a wallet, cellphone, charger, earphones, sunglasses, an 11-inch tablet, an A5 book, pens, keys, cards, etc.
",B09TL193PL,"Craloft, Craloft, Sidhpur Highway, Beside National Auto Service Center, Kakoshi Char Rasta, pin-384151, Gujarat"
